{
  "mediaAssetId": "01a0fc13-0a50-7e9a-95b2-639cfe038833",
  "targetEntityType": "SENSE",
  "targetId": "01a0fc13-09ed-70b4-801b-408be3b771e9",
  "mediaKind": "IMAGE",
  "semanticBrief": [
    {
      "language": "en",
      "text": "One clearly recognizable fresh apple, whole and cut to show the flesh, on a clean neutral background; no text, logo, package, or other fruit."
    }
  ],
  "styleId": "PILOT_IMAGE_NEUTRAL",
  "status": "PLANNED",
  "versions": [],
  "deliveries": [],
  "createdAt": "2026-10-02T00:00:00Z",
  "updatedAt": "2026-10-02T00:00:00Z"
}
